{
  "schema_version": 1,
  "chunk_id": "chunk_05_01",
  "grid_size": [128, 72],
  "cell_size": 8,
  "empty_id": -1,
  "tile_id_map": "res://assets/tilesets/tile_id_map.json",
  "layers": {
    "structure": {
      "encoding": "rle",
      "data": [-1,8006,0,43,-1,963,0,76,-1,52,0,76],
      "cells": 195
    },
    "wallpaper": {
      "encoding": "rle",
      "data": [-1,7121,6,1,7,7,8,1,-1,9,6,1,7,7,8,1,-1,7,6,1,7,7,8,1,-1,85,9,1,-1,7,10,1,-1,9,9,1,-1,7,10,1,-1,7,9,1,-1,7,10,1,-1,85,9,1,-1,7,10,1,-1,9,9,1,-1,7,10,1,-1,7,9,1,-1,7,10,1,-1,85,9,1,-1,7,10,1,-1,9,9,1,-1,7,10,1,-1,7,9,1,-1,7,10,1,-1,85,9,1,-1,7,10,1,-1,9,9,1,-1,7,10,1,-1,7,9,1,-1,7,10,1,-1,85,11,1,12,7,13,1,-1,9,11,1,12,7,13,1,-1,7,11,1,12,7,13,1,-1,1412],
      "cells": 78
    },
    "mosaic": {
      "encoding": "rle",
      "data": [-1,7117,0,4,-1,9,0,9,-1,9,0,6,3,1,-1,9,0,4,-1,76,0,5,-1,9,0,9,-1,9,0,6,3,1,-1,9,0,4,-1,75,0,6,-1,9,0,9,-1,9,0,6,3,1,-1,9,0,4,-1,74,0,7,-1,9,0,9,-1,9,0,6,3,1,-1,9,0,4,-1,73,0,8,-1,9,0,9,-1,9,0,6,3,1,-1,9,0,4,-1,72,0,9,-1,9,0,9,-1,9,0,6,3,1,-1,9,0,4,-1,71,0,43,3,1,0,13,-1,113,2,1,3,1,0,13,-1,58,0,55,2,1,3,1,0,13,-1,57,0,56,2,1,3,1,0,13,-1,56,0,57,2,1,3,1,0,13,-1,55,0,58,2,1,3,1,0,13,-1,54,0,59,2,1,3,1,0,13,-1,53,0,60,2,1,3,1,0,13,-1,52,0,7,-1,2,0,52,2,1,3,1,0,13,-1,256],
      "cells": 740
    },
    "interior1": {
      "encoding": "rle",
      "data": [-1,116,240,1,-1,1,240,1,-1,125,92,1,-1,1,92,1,-1,125,92,1,-1,1,92,1,-1,125,92,1,-1,1,92,1,-1,125,92,1,-1,1,92,1,-1,125,92,1,-1,1,92,1,-1,125,92,1,-1,1,92,1,-1,125,92,1,-1,1,92,1,-1,125,92,1,-1,1,92,1,-1,125,92,3,-1,125,92,3,-1,125,92,3,-1,9,97,103,59,10,95,1,96,1,59,8,-1,113,92,1,-1,4,95,1,96,1,-1,4,92,1,-1,116,92,1,-1,4,95,1,96,1,-1,4,92,1,-1,116,92,1,-1,4,95,1,96,1,-1,4,92,1,-1,116,92,1,-1,4,95,1,96,1,-1,4,92,1,-1,116,92,1,-1,4,95,1,96,1,-1,4,92,1,-1,116,92,1,-1,4,95,1,96,1,-1,4,92,1,-1,116,92,1,-1,4,95,1,96,1,-1,4,92,1,-1,116,92,1,-1,4,95,1,96,1,-1,4,92,1,-1,116,92,1,-1,4,95,1,96,1,-1,4,92,1,-1,116,92,1,59,4,95,1,96,1,59,4,92,1,-1,116,92,1,-1,4,95,1,96,1,-1,4,92,1,-1,116,92,1,-1,4,95,1,96,1,-1,4,92,1,-1,116,92,1,-1,4,95,1,96,1,-1,4,92,1,-1,116,92,1,-1,4,95,1,96,1,-1,4,92,1,-1,116,92,1,-1,4,95,1,96,1,-1,4,92,1,-1,116,92,1,-1,4,95,1,96,1,-1,4,92,1,-1,116,92,1,-1,4,95,1,96,1,-1,4,92,1,-1,116,92,1,-1,4,95,1,96,1,-1,4,92,1,-1,116,92,1,-1,4,95,1,96,1,-1,4,92,1,-1,116,92,1,-1,4,95,1,96,1,-1,1,13,1,14,1,-1,1,92,1,-1,116,92,1,59,4,95,1,96,1,59,4,92,1,-1,116,92,1,-1,4,95,1,96,1,-1,4,92,1,-1,116,92,1,-1,4,95,1,96,1,-1,4,92,1,-1,116,92,1,-1,4,95,1,96,1,-1,4,92,1,-1,116,92,1,-1,4,95,1,96,1,-1,4,92,1,-1,116,92,1,-1,4,95,1,96,1,-1,4,92,1,-1,116,92,1,-1,4,95,1,96,1,-1,4,92,1,-1,116,92,1,-1,4,95,1,96,1,-1,4,92,1,-1,116,92,1,-1,4,95,1,96,1,-1,4,92,1,-1,116,92,1,-1,4,95,1,96,1,-1,4,92,1,-1,116,92,1,-1,4,95,1,96,1,-1,4,92,1,-1,116,92,1,-1,4,95,1,96,1,-1,4,92,1,-1,116,92,1,59,4,98,1,99,1,59,4,92,1,-1,115,100,1,101,1,102,1,103,1,-1,2,95,1,96,1,-1,2,100,1,101,1,102,1,103,1,-1,113,100,1,101,1,-1,2,102,1,103,1,-1,1,95,1,96,1,-1,1,100,1,101,1,-1,2,102,1,103,1,-1,87,0,1,1,1,-1,22,100,1,101,1,-1,4,102,1,103,1,95,1,96,1,100,1,101,1,-1,4,102,1,103,1,-1,86,3,1,4,1,-1,21,100,1,101,1,-1,6,102,1,95,1,96,1,101,1,-1,6,102,1,103,1,-1,85,6,1,7,1,-1,20,100,1,101,1,-1,8,95,1,96,1,-1,8,102,1,103,1,-1,81,9,50,-1,77,9,51,-1,76,9,52,-1,76,9,52,-1,75,9,2,-1,125,9,2,-1,45,137,1,138,1,-1,78,9,2,-1,46,93,1,94,1,-1,77,9,2,-1,125,9,2,-1,125,9,2,-1,125,9,2,-1,114,9,1,-1,2,9,10,-1,114,9,2,-1,125,9,2,-1,125,9,2,-1,125,9,2,-1,125,9,2,-1,125,9,2,-1,125,9,2,-1,7,13,1,14,1,-1,70,9,49,-1,79,9,49,-1,76],
      "cells": 706
    },
    "collision": {
      "encoding": "rle",
      "data": [-1,1536,4,103,2,11,3,1,2,8,-1,118,3,2,-1,126,3,2,-1,126,3,2,-1,126,3,2,-1,126,3,2,-1,126,3,2,-1,126,3,2,-1,126,3,2,-1,126,3,2,-1,122,2,5,3,1,2,4,-1,122,3,2,-1,126,3,2,-1,126,3,2,-1,126,3,2,-1,126,3,2,-1,126,3,2,-1,126,3,2,-1,126,3,2,-1,126,3,2,-1,126,3,2,-1,122,2,5,3,1,2,4,-1,122,3,2,-1,126,3,2,-1,126,3,2,-1,126,3,2,-1,126,3,2,-1,126,3,2,-1,126,3,2,-1,126,3,2,-1,126,3,2,-1,126,3,2,-1,126,3,2,-1,122,2,5,3,1,2,4,-1,122,3,2,-1,126,3,2,-1,94,1,2,-1,30,3,2,-1,94,1,1,-1,31,3,2,-1,94,1,1,-1,31,3,2,-1,91,2,50,-1,77,2,51,-1,76,2,38,3,1,2,13,-1,76,2,38,3,1,2,13,-1,75,2,2,-1,37,3,1,-1,87,2,2,-1,38,3,1,-1,86,2,2,-1,39,3,1,-1,85,2,2,-1,40,3,1,-1,84,2,2,-1,41,3,1,-1,83,2,2,-1,42,3,1,-1,82,2,2,-1,43,3,1,-1,76,2,50,3,2,-1,69,2,2,-1,55,3,2,-1,68,2,2,-1,56,3,2,-1,67,2,2,-1,57,3,2,-1,66,2,2,-1,58,3,2,-1,65,2,2,-1,59,3,2,-1,64,2,2,-1,60,3,2,-1,63,2,2,-1,61,3,2,-1,16,2,125,-1,3,2,125],
      "cells": 783
    }
  },
  "entities": [],
  "meta": {
    "source": "res://scenes/world/chunks/chunk_05_01.tscn"
  }
}
