{"schema_version":1,"chunk_id":"chunk_00_03","grid_size":[128,72],"cell_size":8,"empty_id":-1,"tile_id_map":"res://assets/tilesets/tile_id_map.json","layers":{"earth":{"encoding":"rle","data":[-1,2400,0,10,-1,12,0,10,-1,96,0,10,-1,12,0,10,-1,96,0,9,-1,14,0,9,-1,96,0,10,-1,12,0,10,-1,96,0,9,-1,14,0,9,-1,96,0,10,-1,12,0,10,-1,96,0,9,-1,13,0,10,-1,96,0,8,-1,18,0,6,-1,96,0,4,-1,23,0,5,-1,96,0,4,-1,24,0,4,-1,96,0,3,-1,26,0,3,-1,96,0,2,-1,28,0,2,-1,96,0,2,-1,28,0,2,-1,96,0,2,-1,1,0,2,-1,23,0,4,-1,96,0,5,-1,23,0,4,-1,96,0,6,-1,1,0,1,-1,17,0,7,-1,63,0,1,-1,32,0,8,-1,1,0,1,-1,2,0,1,-1,1,0,2,-1,1,0,1,-1,2,0,1,-1,1,0,2,-1,1,0,7,-1,62,0,2,-1,32,0,10,-1,1,0,7,-1,1,0,6,-1,1,0,6,-1,62,0,66,-1,62,0,37,-1,19,0,1,-1,6,0,3,-1,63,0,36,-1,26,0,3,-1,62,0,66,-1,63,0,65,-1,62,0,66,-1,62,0,66,-1,62,0,66,-1,63,0,65,-1,62,0,66,-1,63,0,65,-1,62,0,66,-1,62,0,66,-1,62,0,66,-1,63,0,65,-1,62,0,66,-1,63,0,65,-1,62,0,66,-1,62,0,66,-1,62,0,66,-1,63,0,65,-1,62,0,66,-1,63,0,65,-1,62,0,66,-1,62,0,49,-1,6,0,1,-1,72,0,49,-1,80,0,45,-1,82,0,46,-1,83,0,44,-1,83,0,44,-1,84,0,44,-1,84,0,44,-1,85,0,42,-1,85,0,44,-1,85,0,42,-1,14,0,1,-1,1,0,1,-1,2,0,1,-1,1,0,2,-1,62,0,44,-1,12,0,4,-1,1,0,5],"cells":2343},"structure":{"encoding":"rle","data":[-1,1121,0,22,-1,2,0,7,-1,1258,1,1,2,6,3,1,4,1,2,2,-1,118,2,6,3,1,4,1,2,2,-1,117,1,1,2,6,3,1,4,1,2,2,-1,118,2,6,3,1,4,1,2,2,-1,117,1,1,2,6,3,1,4,1,2,2,-1,118,2,6,3,1,4,1,2,2,-1,118,2,6,3,1,4,1,2,2,5,1,-1,115,6,1,2,7,3,1,4,1,2,3,-1,1,6,1,5,1,-1,109,7,1,6,1,8,1,2,8,3,1,4,1,2,3,8,1,2,2,8,1,6,1,-1,106,2,12,3,1,4,1,2,8,7,1,-1,103,8,1,2,13,3,1,4,1,2,9,5,1,-1,102,2,14,3,1,4,1,2,10,-1,104,2,12,3,1,4,1,2,8,-1,107,2,11,3,1,4,1,2,7,-1,109,2,10,3,1,4,1,2,5,-1,5000],"cells":273},"wallpaper":{"encoding":"rle","data":[-1,7802,0,1,-1,1,1,1,2,1,-1,115,3,3,0,1,1,1,3,1,2,1,3,1,2,1,3,1,2,1,3,2,0,1,3,1,-1,110,0,1,-1,2,3,15,-1,109,3,2,-1,2,3,15,-1,107,2,1,3,3,-1,2,3,15,-1,107,3,4,-1,2,3,15,-1,106,4,1,3,4,-1,2,3,15,-1,107,3,4,-1,2,3,15,-1,106,4,1,3,4,-1,2,3,15,-1,107,3,4,-1,123,4,1,3,4,-1,2,3,4,-1,118,3,4,-1,2,3,4,-1,11],"cells":169},"mosaic":{"encoding":"rle","data":[-1,97,0,22,2,1,3,1,0,7,-1,97,0,4,-1,4,0,14,2,1,3,1,0,7,-1,97,0,4,-1,4,0,14,2,1,3,1,0,7,-1,97,0,4,-1,4,0,14,2,1,3,1,0,7,-1,97,0,2,-1,4,0,1,-1,3,0,12,2,1,3,1,0,7,-1,103,0,1,-1,3,0,12,2,1,3,1,0,7,-1,103,0,1,-1,3,0,12,2,1,3,1,0,7,-1,103,0,1,-1,3,0,12,2,1,3,1,0,7,-1,119,2,1,3,1,-1,107,0,19,2,1,3,1,0,7,-1,100,0,3,-1,4,0,12,2,1,3,1,0,7,-1,100,0,3,-1,4,0,12,2,1,3,1,0,4,1,1,0,2,-1,102,0,1,-1,11,0,5,2,1,3,1,0,7,-1,104,0,1,-1,9,0,5,2,1,3,1,0,7,-1,104,0,1,-1,9,0,5,2,1,3,1,0,7,-1,104,0,1,-1,9,0,5,2,1,3,1,0,7,-1,2238,4,30,-1,4900],"cells":370},"interior1":{"encoding":"rle","data":[-1,92,9,5,-1,123,9,5,-1,123,9,5,-1,123,9,5,-1,123,9,5,-1,123,9,5,-1,123,9,5,-1,123,9,5,-1,123,9,5,-1,123,9,5,-1,123,9,5,-1,123,9,5,-1,123,9,5,-1,123,9,5,-1,123,9,5,-1,123,9,5,-1,123,9,36,-1,92,9,36,-1,92,9,4,-1,21,24,1,-1,102,9,4,-1,10,25,1,-1,10,26,1,-1,102,9,4,-1,9,27,1,-1,11,28,1,29,1,-1,101,9,4,-1,10,30,1,-1,10,24,1,-1,102,9,4,-1,9,25,1,-1,11,31,1,27,1,-1,101,9,4,-1,10,30,1,-1,10,28,1,-1,102,9,4,-1,9,32,1,30,1,-1,113,9,4,-1,8,33,1,-1,13,33,1,-1,2,33,1,-1,98,9,4,-1,4,34,1,35,1,-1,118,9,4,-1,4,35,1,-1,119,9,4,-1,124,9,4,-1,2,30,1,-1,26,28,1,-1,94,9,4,-1,2,34,1,36,1,37,1,-1,22,38,1,37,1,39,1,-1,94,9,4,-1,2,34,1,-1,2,40,1,-1,20,38,1,39,1,-1,96,9,4,-1,5,34,1,37,1,-1,17,38,1,37,1,39,1,32,1,-1,65,41,1,-1,30,9,4,-1,6,42,1,-1,1,34,1,40,1,39,1,43,1,37,1,36,1,43,1,39,1,34,1,40,1,39,1,43,1,37,1,36,1,43,1,39,2,-1,68,44,1,45,1,-1,1,9,32,-1,8,42,1,-1,1,32,1,36,1,-1,1,39,1,-1,2,42,1,-1,1,32,1,36,1,-1,1,39,1,-1,2,32,1,-1,68,46,1,-1,2,9,32,-1,10,47,1,-1,7,47,1,-1,6,48,1,-1,67,49,1,-1,127,50,1,-1,127,46,1,51,1,-1,126,49,1,-1,127,44,1,45,1,-1,126,46,1,-1,127,49,1,-1,127,50,1,-1,127,46,1,51,1,-1,126,49,1,-1,127,44,1,45,1,-1,126,46,1,-1,127,49,1,-1,127,50,1,-1,127,46,1,51,1,-1,126,49,1,-1,127,44,1,45,1,-1,126,46,1,-1,127,49,1,-1,127,50,1,-1,127,46,1,51,1,-1,126,49,1,-1,127,44,1,45,1,-1,126,46,1,-1,127,49,1,-1,49,52,1,53,1,54,2,55,2,-1,1,54,1,55,1,54,1,55,1,-1,1,55,1,-1,2,55,1,54,1,-1,61,50,1,-1,49,52,1,53,1,-1,76,46,1,51,1,-1,45,56,1,54,1,-1,1,52,1,53,1,-1,76,49,1,-1,46,54,1,-1,2,52,1,53,1,-1,76,44,1,45,1,-1,48,52,1,53,1,-1,76,46,1,-1,44,57,1,-1,4,52,1,53,1,-1,76,49,1,-1,49,52,1,53,1,-1,76,50,1,-1,44,58,1,-1,4,52,1,53,1,-1,76,46,1,51,1,-1,42,45,1,-1,5,52,1,53,1,-1,76,49,1,-1,44,57,1,-1,4,52,1,53,1,59,5,60,1,41,1,56,1,61,1,62,1,63,1,64,1,65,1,63,1,62,1,-1,61,44,1,45,1,-1,42,58,1,-1,5,52,1,53,1,-1,4,44,1,45,1,-1,1,66,1,-1,1,67,1,65,1,-1,1,62,1,-1,63,46,1,-1,44,57,1,-1,4,52,1,53,1,-1,4,46,1,-1,4,68,1,-1,5],"cells":468},"interior2":{"encoding":"rle","data":[-1,229,15,1,16,2,17,1,-1,124,18,1,19,2,20,1,-1,124,21,1,22,2,23,1,-1,122,15,1,16,2,17,1,-1,1,15,1,16,1,17,1,-1,118,15,1,16,1,17,1,19,2,20,1,-1,1,18,1,19,1,20,1,-1,118,18,1,19,1,20,1,19,2,20,1,-1,1,18,1,19,1,20,1,-1,118,21,1,22,1,23,1,22,2,23,1,-1,1,21,1,22,1,23,1,-1,246,15,1,16,1,17,1,-1,125,18,1,19,1,20,1,-1,3,15,1,16,2,17,1,-1,118,21,1,22,1,23,1,-1,3,18,1,19,2,20,1,-1,118,15,1,16,3,17,1,-1,1,21,1,22,2,15,1,16,6,17,1,-1,111,18,1,19,3,15,1,16,1,17,1,-1,1,15,1,18,1,19,6,20,1,-1,111,18,1,19,3,18,1,19,1,20,1,-1,1,18,2,19,6,20,1,-1,111,21,1,22,3,21,1,22,1,23,1,-1,1,21,2,22,6,23,1,-1,7182],"cells":127},"structure_front":{"encoding":"rle","data":[-1,1140,0,3,-1,2,0,3,-1,8068],"cells":6},"collision":{"encoding":"rle","data":[-1,92,2,5,-1,22,3,2,-1,99,2,5,-1,22,3,2,-1,99,2,5,-1,22,3,2,-1,99,2,5,-1,22,3,2,-1,99,2,5,-1,22,3,2,-1,99,2,5,-1,22,3,2,-1,99,2,5,-1,22,3,2,-1,99,2,5,-1,22,3,2,-1,99,2,36,-1,92,2,5,-1,22,3,2,-1,99,2,5,-1,22,3,2,-1,99,2,5,-1,22,3,2,-1,99,2,5,-1,22,3,2,-1,99,2,5,-1,22,3,2,-1,99,2,5,-1,22,3,2,-1,99,2,5,-1,22,3,2,-1,99,2,36,-1,92,2,36,-1,92,2,15,-1,7,3,1,-1,3,2,10,-1,92,2,14,-1,8,3,1,-1,3,2,10,-1,92,2,14,-1,8,3,1,-1,4,2,9,-1,92,2,14,-1,8,3,1,-1,3,2,10,-1,92,2,14,-1,8,3,1,-1,4,2,9,-1,92,2,14,-1,8,3,1,-1,3,2,10,-1,92,2,13,-1,9,3,1,-1,3,2,10,-1,92,2,13,-1,9,3,1,-1,4,2,2,-1,1,2,6,-1,92,2,8,-1,2,2,3,-1,9,3,1,-1,3,2,1,-1,3,2,6,-1,92,2,8,-1,14,3,1,-1,8,2,5,-1,92,2,8,-1,14,3,1,-1,9,2,4,-1,92,2,6,-1,16,3,1,-1,11,2,2,-1,92,2,6,-1,16,3,1,-1,11,2,2,-1,92,2,6,-1,1,2,2,-1,13,3,1,-1,9,2,4,-1,92,2,9,-1,13,3,1,-1,9,2,4,-1,62,2,40,-1,12,3,1,-1,6,2,7,-1,61,2,45,-1,2,2,6,3,1,-1,1,2,12,-1,61,2,60,-1,1,2,6,-1,61,2,67,-1,61,2,38,-1,19,2,1,-1,6,2,3,-1,61,2,38,-1,26,2,3,-1,61,2,67,-1,61,2,67,-1,61,2,67,-1,61,2,67,-1,61,2,67,-1,61,2,67,-1,61,2,67,-1,61,2,67,-1,61,2,67,-1,61,2,67,-1,61,2,67,-1,61,2,67,-1,61,2,67,-1,61,2,67,-1,61,2,67,-1,61,2,67,-1,61,2,67,-1,61,2,67,-1,61,2,67,-1,61,2,67,-1,61,2,67,-1,61,2,50,3,2,2,9,-1,1,2,1,-1,2,2,2,-1,61,2,50,3,2,-1,76,2,49,-1,1,3,2,-1,76,2,48,-1,2,3,2,-1,76,2,46,-1,4,3,2,-1,76,2,46,-1,4,3,2,-1,76,2,45,-1,5,3,2,-1,76,2,46,-1,4,3,2,-1,76,2,45,-1,5,3,2,-1,76,2,46,-1,4,3,2,2,15,-1,61,2,45,-1,5,3,2,-1,4,2,11,-1,61,2,46,-1,4,3,2,-1,4,2,11],"cells":2869}},"entities":[{"type":"invuln","position":[117.0,31.5],"params":{"required":""},"id":"bonus"}],"meta":{"source":"res://scenes/world/chunks/chunk_00_03.tscn"}}