{"schema_version":1,"chunk_id":"chunk_04_00","grid_size":[128,72],"cell_size":8,"empty_id":-1,"tile_id_map":"res://assets/tilesets/tile_id_map.json","layers":{"wallpaper":{"encoding":"rle","data":[-1,1053,23,1,24,1,25,1,26,1,-1,124,27,1,28,1,29,1,30,1,31,1,32,1,33,1,-1,123,34,1,-1,7904],"cells":12},"interior1":{"encoding":"rle","data":[-1,672,189,1,190,1,191,1,192,1,193,1,194,1,-1,117,195,1,190,1,196,1,197,1,198,1,199,1,200,1,201,1,202,1,203,1,-1,119,204,1,205,1,206,1,207,1,208,1,209,1,210,1,211,1,212,1,213,1,-1,123,214,1,215,1,216,1,-1,504,217,1,218,1,219,1,220,1,221,1,222,1,221,1,222,1,219,1,220,1,-1,118,223,1,224,1,225,1,226,1,227,1,228,1,227,1,229,1,225,1,226,1,-1,2547,9,11,-1,117,9,11,-1,117,9,11,-1,117,9,11,-1,117,9,11,-1,117,9,9,-1,119,93,1,94,1,-1,3,9,4,-1,124,9,4,-1,124,9,4,-1,124,9,4,-1,124,9,4,-1,124,9,5,-1,123,9,5,-1,123,9,3,-1,125,9,3,-1,125,9,3,-1,125,9,5,-1,93,59,8,-1,22,9,5,-1,96,92,1,-1,26,9,5,-1,96,92,1,-1,26,9,7,-1,94,92,1,-1,26,9,6,-1,95,92,1,-1,26,9,6,-1,95,92,1,-1,26,9,6,-1,95,92,1,-1,26,9,6,-1,95,92,1,-1,26,9,6,-1,95,92,1,-1,26,9,6,-1,95,92,1,-1,26,9,6,-1,95,92,1,-1,21,9,11,-1,95,92,1,-1,21,9,11,-1,95,92,1,-1,21,9,11,-1,95,92,1,-1,21,9,11,-1,95,92,1,-1,16,9,16,-1,95,92,1,-1,15,9,17,-1,95,92,1,-1,14,9,18,-1,95,92,1,-1,13,9,19,-1,92,9,5,-1,11,9,20,-1,92,9,5,-1,11,9,20,-1,92,9,5,-1,11,9,20,-1,92,9,5,-1,11,9,20,-1,92],"cells":457},"collision":{"encoding":"rle","data":[-1,4249,2,11,-1,117,2,11,-1,117,2,11,-1,117,2,11,-1,117,2,11,-1,117,2,9,-1,119,1,1,-1,4,2,4,-1,124,2,4,-1,124,2,4,-1,124,2,4,-1,124,2,4,-1,124,2,5,-1,123,2,5,-1,123,2,3,-1,125,2,3,-1,125,2,3,-1,125,2,5,-1,93,2,8,-1,22,2,5,-1,123,2,5,-1,123,2,7,-1,121,2,6,-1,122,2,6,-1,122,2,6,-1,122,2,6,-1,122,2,6,-1,122,2,6,-1,122,2,6,-1,117,2,11,-1,117,2,11,-1,117,2,11,-1,117,2,11,-1,112,2,16,-1,111,2,17,-1,110,2,18,-1,109,2,19,-1,92,2,5,-1,11,2,20,-1,92,2,5,-1,11,2,20,-1,92,2,5,-1,11,2,20,-1,92,2,5,-1,11,2,20,-1,92],"cells":390}},"entities":[],"meta":{"source":"res://scenes/world/chunks/chunk_04_00.tscn"}}