{
  "schema_version": 1,
  "chunk_id": "chunk_07_02",
  "grid_size": [128, 72],
  "cell_size": 8,
  "empty_id": -1,
  "tile_id_map": "res://assets/tilesets/tile_id_map.json",
  "layers": {
    "earth": {
      "encoding": "rle",
      "data": [-1,8960,0,3,-1,125,0,2,-1,126],
      "cells": 5
    },
    "mosaic": {
      "encoding": "rle",
      "data": [-1,8832,4,2,-1,382],
      "cells": 2
    },
    "collision": {
      "encoding": "rle",
      "data": [-1,9090,2,2,-1,124],
      "cells": 2
    }
  },
  "entities": [],
  "meta": {
    "source": "res://scenes/world/chunks/chunk_07_02.tscn"
  }
}
