{
  "schema_version": 1,
  "chunk_id": "chunk_00_06",
  "grid_size": [128, 72],
  "cell_size": 8,
  "empty_id": -1,
  "tile_id_map": "res://assets/tilesets/tile_id_map.json",
  "layers": {
    "earth": {
      "encoding": "rle",
      "data": [-1,62,0,44,-1,12,0,10,-1,62,0,44,-1,12,0,10,-1,63,0,42,-1,14,0,9,-1,62,0,44,-1,12,0,10,-1,63,0,42,-1,14,0,9,-1,62,0,44,-1,12,0,10,-1,62,0,44,-1,12,0,2,-1,5,0,1,-1,64,0,44,-1,85,0,42,-1,85,0,44,-1,85,0,42,-1,85,0,44,-1,84,0,44,-1,84,0,44,-1,1,0,2,-1,82,0,46,-1,81,0,48,-1,1,0,1,-1,79,0,49,-1,1,0,1,-1,2,0,1,-1,1,0,2,-1,1,0,1,-1,2,0,1,-1,1,0,2,-1,62,0,52,-1,1,0,7,-1,1,0,5,-1,62,0,66,-1,62,0,66,-1,63,0,65,-1,62,0,66,-1,63,0,65,-1,62,0,66,-1,62,0,66,-1,62,0,66,-1,63,0,65,-1,62,0,66,-1,63,0,65,-1,62,0,66,-1,62,0,66,-1,62,0,66,-1,63,0,65,-1,62,0,66,-1,63,0,65,-1,62,0,66,-1,62,0,66,-1,62,0,66,-1,63,0,65,-1,62,0,66,-1,63,0,65,-1,62,0,66,-1,62,0,66,-1,62,0,66,-1,63,0,65,-1,62,0,66,-1,63,0,65,-1,62,0,66,-1,62,0,66,-1,62,0,66,-1,63,0,65,-1,62,0,66,-1,63,0,65,-1,62,0,66,-1,63,0,65,-1,62,0,66,-1,62,0,66,-1,1665,0,1,-1,2,0,1,-1,1,0,2,-1,1,0,1,-1,2,0,1,-1,1,0,2,-1,1,0,1,-1,2,0,1,-1,1,0,2,-1,1,0,1,-1,2,0,1,-1,1,0,2,-1,1,0,1,-1,2,0,1,-1,1,0,2,-1,1,0,1,-1,2,0,1,-1,1,0,2,-1,1,0,1,-1,2,0,1,-1,1,0,2,-1,1,0,1,-1,2,0,1,-1,1,0,2,-1,1,0,1,-1,2,0,1,-1,1,0,2,-1,1,0,1,-1,2,0,1,-1,1,0,2,-1,1,0,1,-1,2,0,1,-1,1,0,2,-1,1,0,1,-1,2,0,1,-1,1,0,2,-1,1,0,1,-1,2,0,1,-1,1,0,2,-1,1,0,1,-1,2,0,1,-1,1,0,2,-1,1,0,1,-1,2,0,1,-1,1,0,2,-1,1,0,1,-1,2,0,1,-1,1,0,4,-1,1,0,7,-1,1,0,7,-1,1,0,7,-1,1,0,7,-1,1,0,7,-1,1,0,7,-1,1,0,7,-1,1,0,7,-1,1,0,7,-1,1,0,7,-1,1,0,7,-1,1,0,7,-1,1,0,7,-1,1,0,7,-1,1,0,7,-1,1,0,5],
      "cells": 3624
    },
    "structure": {
      "encoding": "rle",
      "data": [-1,7362,9,4,-1,4,9,4,-1,4,9,4,-1,4,9,4,-1,4,9,4,-1,4,9,4,-1,4,9,4,-1,4,9,4,-1,1794],
      "cells": 32
    },
    "wallpaper": {
      "encoding": "rle",
      "data": [-1,106,4,1,3,4,-1,2,3,4,-1,118,3,4,-1,2,3,4,-1,117,4,1,3,4,-1,2,3,4,-1,118,3,4,-1,2,3,4,-1,117,4,1,3,4,-1,2,3,4,-1,118,3,4,-1,2,3,4,-1,117,4,1,3,4,-1,2,3,4,5,1,-1,117,3,4,-1,2,3,5,-1,1,1,1,2,1,3,3,0,1,1,1,3,1,2,1,-1,106,4,1,3,4,-1,2,3,5,2,1,3,9,-1,107,3,4,-1,2,3,15,-1,106,4,1,3,4,-1,2,3,15,-1,107,3,4,-1,2,3,15,-1,109,3,2,-1,2,3,15,-1,110,3,1,-1,2,3,15,-1,113,3,15,-1,5439,3,1,-1,126,2,1,3,65,-1,63,3,65,-1,63,3,65,-1,63,3,65,-1,63,3,65,-1,63,3,65,-1,63,3,65,-1,63,3,65,-1,63,3,5,-1,2,3,11,-1,2,3,27,-1,2,3,16,-1,63,3,5,-1,2,3,11,-1,2,3,27,-1,2,3,16,-1,63,3,5,-1,2,3,11,-1,2,3,27,-1,2,3,16,-1,384],
      "cells": 904
    },
    "interior1": {
      "encoding": "rle",
      "data": [-1,61,49,1,-1,49,52,1,53,1,-1,4,49,1,-1,71,50,1,-1,44,58,1,-1,4,52,1,53,1,-1,4,50,1,-1,71,46,1,51,1,-1,42,45,1,-1,5,52,1,53,1,-1,4,46,1,51,1,-1,70,49,1,-1,44,57,1,-1,4,52,1,53,1,-1,4,49,1,-1,71,44,1,45,1,-1,42,58,1,-1,5,52,1,53,1,-1,4,44,1,45,1,-1,70,46,1,-1,44,57,1,-1,4,52,1,53,1,-1,4,46,1,-1,71,49,1,-1,49,52,1,53,1,-1,7,55,1,54,2,55,2,-1,1,54,1,55,1,-1,61,50,1,-1,44,58,1,-1,4,52,1,53,1,-1,5,55,1,-1,70,46,1,51,1,-1,42,45,1,-1,5,52,1,53,1,-1,76,49,1,-1,44,57,1,-1,4,52,1,53,1,-1,76,44,1,45,1,-1,42,58,1,-1,5,52,1,53,1,-1,76,46,1,-1,44,57,1,-1,4,52,1,53,1,-1,76,49,1,-1,44,56,1,65,1,64,1,-1,2,52,1,53,1,-1,76,50,1,-1,44,56,1,-1,2,61,1,-1,1,52,1,53,1,-1,76,46,1,51,1,-1,46,56,1,64,1,52,1,53,1,-1,76,49,1,-1,48,66,1,-1,1,56,1,61,1,62,1,63,1,64,1,65,1,63,1,62,1,56,1,61,1,62,1,63,1,64,1,65,1,63,1,62,1,-1,61,44,1,45,1,-1,49,66,1,-1,1,67,1,65,1,-1,1,62,1,-1,2,66,1,-1,1,67,1,65,1,-1,1,62,1,-1,63,46,1,-1,52,68,1,-1,7,68,1,-1,66,49,1,-1,127,50,1,-1,127,46,1,51,1,-1,126,49,1,-1,127,44,1,45,1,-1,126,46,1,-1,127,49,1,-1,127,50,1,-1,127,46,1,51,1,-1,126,49,1,-1,127,44,1,45,1,-1,126,46,1,-1,127,49,1,-1,127,50,1,-1,127,46,1,51,1,-1,126,49,1,-1,127,44,1,45,1,-1,126,46,1,-1,127,49,1,-1,127,50,1,-1,127,46,1,51,1,-1,126,49,1,-1,127,44,1,45,1,-1,126,46,1,-1,127,49,1,-1,127,50,1,-1,127,46,1,51,1,-1,126,49,1,-1,127,44,1,45,1,-1,126,46,1,-1,127,49,1,-1,127,50,1,-1,127,46,1,51,1,-1,126,49,1,-1,127,44,1,45,1,-1,126,46,1,-1,127,44,1,45,1,-1,126,46,1,-1,202,69,1,-1,53,55,1,-1,1,54,1,70,1,-1,4,71,1,54,2,70,1,-1,4,71,1,54,2,70,1,-1,4,71,1,54,2,70,1,-1,4,71,1,54,2,70,1,-1,4,71,1,54,2,70,1,-1,4,71,1,54,2,70,1,-1,4,71,1,54,2,70,1,-1,4,71,1,54,1,-1,8,69,1,-1,127,69,1,-1,127,69,1,-1,127,69,1,-1,127,69,1,-1,127,69,1,-1,127,69,1,-1,127,69,1,-1,127,69,1,-1,33,0,1,72,1,-1,24,0,1,72,1,-1,11,0,1,1,1,-1,27,0,1,1,1,-1,24,69,1,-1,33,3,1,73,1,-1,24,3,1,73,1,-1,11,3,1,4,1,-1,27,3,1,4,1,-1,24,69,1,-1,33,6,1,74,1,-1,24,6,1,74,1,-1,11,6,1,7,1,-1,27,6,1,7,1,-1,16,56,1,61,1,62,1,63,1,64,1,65,1,63,1,62,1,56,1,61,1,62,1,63,1,64,1,65,1,63,1,62,1,56,1,61,1,62,1,63,1,64,1,65,1,63,1,62,1,56,1,61,1,62,1,63,1,64,1,65,1,63,1,62,1,56,1,61,1,62,1,63,1,64,1,65,1,63,1,62,1,56,1,61,1,62,1,63,1,64,1,65,1,63,1,62,1,56,1,61,1,62,1,63,1,64,1,65,1,63,1,62,1,56,1,61,1,62,1,63,1,64,1,65,1,63,1,62,1,56,1,61,1,62,1,63,1,64,1,65,1,63,1,62,1,56,1,61,1,62,1,63,1,64,1,65,1,63,1,62,1,56,1,61,1,62,1,63,1,64,1,65,1,63,1,62,1,56,1,61,1,62,1,63,1,64,1,65,1,63,1,62,1,56,1,61,1,62,1,63,1,64,1,65,1,63,1,62,1,56,1,61,1,62,1,63,1,64,1,65,1,63,1,62,1,56,1,61,1,62,1,63,1,64,1,65,1,63,1,62,1,56,1,61,1,62,1,63,1,64,1,65,1,63,1,62,1,66,1,-1,1,67,1,65,1,-1,1,62,1,-1,2,66,1,-1,1,67,1,65,1,-1,1,62,1,-1,2,66,1,-1,1,67,1,65,1,-1,1,62,1,-1,2,66,1,-1,1,67,1,65,1,-1,1,62,1,-1,2,66,1,-1,1,67,1,65,1,-1,1,62,1,-1,2,66,1,-1,1,67,1,65,1,-1,1,62,1,-1,2,66,1,-1,1,67,1,65,1,-1,1,62,1,-1,2,66,1,-1,1,67,1,65,1,-1,1,62,1,-1,2,66,1,-1,1,67,1,65,1,-1,1,62,1,-1,2,66,1,-1,1,67,1,65,1,-1,1,62,1,-1,2,66,1,-1,1,67,1,65,1,-1,1,62,1,-1,2,66,1,-1,1,67,1,65,1,-1,1,62,1,-1,2,66,1,-1,1,67,1,65,1,-1,1,62,1,-1,2,66,1,-1,1,67,1,65,1,-1,1,62,1,-1,2,66,1,-1,1,67,1,65,1,-1,1,62,1,-1,2,66,1,-1,1,67,1,65,1,-1,1,62,1,-1,4,68,1,-1,7,68,1,-1,7,68,1,-1,7,68,1,-1,7,68,1,-1,7,68,1,-1,7,68,1,-1,7,68,1,-1,7,68,1,-1,7,68,1,-1,7,68,1,-1,7,68,1,-1,7,68,1,-1,7,68,1,-1,7,68,1,-1,7,68,1,-1,5],
      "cells": 442
    },
    "collision": {
      "encoding": "rle",
      "data": [-1,61,2,45,-1,5,3,2,-1,4,2,11,-1,61,2,46,-1,4,3,2,-1,4,2,11,-1,61,2,45,-1,5,3,2,-1,4,2,11,-1,61,2,46,-1,4,3,2,-1,4,2,11,-1,61,2,45,-1,5,3,2,-1,4,2,11,-1,61,2,46,-1,4,3,2,-1,4,2,11,-1,61,2,45,-1,5,3,2,-1,5,2,10,-1,61,2,46,-1,4,3,2,-1,5,2,1,-1,70,2,45,-1,5,3,2,-1,76,2,46,-1,4,3,2,-1,76,2,45,-1,5,3,2,-1,76,2,46,-1,4,3,2,-1,76,2,48,-1,2,3,2,-1,76,2,49,-1,1,3,2,-1,76,2,50,3,2,-1,76,2,67,-1,61,2,67,-1,61,2,67,-1,61,2,67,-1,61,2,67,-1,61,2,67,-1,61,2,67,-1,61,2,67,-1,61,2,67,-1,61,2,67,-1,61,2,67,-1,61,2,67,-1,61,2,67,-1,61,2,67,-1,61,2,67,-1,61,2,67,-1,61,2,67,-1,61,2,67,-1,61,2,67,-1,61,2,67,-1,61,2,67,-1,61,2,67,-1,61,2,67,-1,61,2,67,-1,61,2,67,-1,61,2,67,-1,61,2,67,-1,61,2,67,-1,61,2,67,-1,61,2,67,-1,61,2,67,-1,61,2,67,-1,61,2,67,-1,61,2,67,-1,61,2,67,-1,61,2,67,-1,61,2,67,-1,61,2,67,-1,61,2,67,-1,61,2,67,-1,61,2,67,-1,62,2,66,-1,8,3,1,-1,53,2,1,-1,1,2,64,-1,8,3,1,-1,127,3,1,-1,127,3,1,-1,127,3,1,-1,127,3,1,-1,127,3,1,-1,127,3,1,-1,127,3,1,-1,127,3,1,-1,33,1,2,-1,24,1,2,-1,11,1,2,-1,27,1,2,-1,24,3,1,-1,33,1,1,-1,25,1,1,-1,12,1,1,-1,28,1,1,-1,25,3,1,-1,33,1,1,-1,25,1,1,-1,12,1,1,-1,28,1,1,-1,17,2,384],
      "cells": 4090
    }
  },
  "entities": [
    {
      "type": "alarm_guard",
      "position": [112.5, 62.0],
      "params": {
        "patrol_distance": 48,
        "spawn_on": "alarm",
        "origin": "top_left",
        "size_px": [48, 56]
      }
    },
    {
      "type": "exit",
      "position": [25.0, 64.0],
      "params": {}
    }
  ],
  "meta": {
    "source": "res://scenes/world/chunks/chunk_00_06.tscn"
  }
}
