{
  "schema_version": 1,
  "chunk_id": "chunk_04_02",
  "grid_size": [128, 72],
  "cell_size": 8,
  "empty_id": -1,
  "tile_id_map": "res://assets/tilesets/tile_id_map.json",
  "layers": {
    "earth": {
      "encoding": "rle",
      "data": [-1,2821,0,4,-1,124,0,4,-1,124,0,4,-1,4348,0,4,-1,124,0,4,-1,124,0,4,-1,1527],
      "cells": 24
    },
    "structure": {
      "encoding": "rle",
      "data": [-1,911,13,1,-1,258,13,1,-1,509,13,1,-1,367,0,22,-1,2,0,6,-1,98,0,22,-1,2,0,6,-1,2018,0,22,-1,2,0,6,-1,2402,0,22,-1,2,0,6,-1,98,0,22,-1,2,0,6,-1,1333,11,2,-1,126,11,2,-1,126,14,1,11,1,-1,126,14,1,11,1,-1,126,14,1,11,1,-1,127,11,1,-1,43,0,8,-1,2,0,7,-1,367],
      "cells": 169
    },
    "mosaic": {
      "encoding": "rle",
      "data": [0,30,-1,98,0,30,-1,98,0,30,-1,98,0,30,-1,98,0,30,-1,98,0,30,-1,98,0,30,-1,98,0,13,19,1,-1,5,20,1,0,10,-1,98,0,13,19,1,21,1,22,3,23,1,20,1,0,10,-1,98,0,13,19,1,-1,5,20,1,0,10,-1,98,0,13,19,1,21,1,22,3,23,1,20,1,0,10,-1,98,0,13,19,1,-1,5,20,1,0,10,-1,98,0,13,19,1,21,1,22,3,23,1,20,1,0,10,-1,98,0,13,19,1,-1,5,20,1,0,10,-1,98,0,13,19,1,21,1,22,3,23,1,20,1,0,10,-1,98,0,13,19,1,0,5,20,1,0,10,-1,120,2,1,3,1,-1,126,2,1,3,1,-1,104,0,22,2,1,3,1,0,6,-1,98,0,22,2,1,3,1,0,6,-1,98,0,22,2,1,3,1,0,6,-1,98,0,4,-1,6,0,12,2,1,3,1,0,6,-1,98,0,4,-1,6,0,12,2,1,3,1,0,6,-1,98,0,4,-1,6,0,12,2,1,3,1,0,6,-1,98,0,4,-1,6,0,12,2,1,3,1,0,6,-1,98,0,4,-1,6,0,12,2,1,3,1,0,6,-1,98,0,5,-1,4,0,13,2,1,3,1,0,6,-1,98,0,22,2,1,3,1,0,6,-1,98,0,22,2,1,3,1,0,6,-1,98,0,22,2,1,3,1,0,6,-1,98,0,22,2,1,3,1,0,6,-1,98,0,22,2,1,3,1,0,6,-1,98,0,22,2,1,3,1,0,6,-1,120,2,1,3,1,-1,104,0,22,2,1,3,1,0,6,-1,98,0,22,2,1,3,1,0,6,-1,98,0,22,2,1,3,1,0,6,-1,98,0,22,2,1,3,1,0,6,-1,98,0,22,2,1,3,1,0,6,-1,98,0,22,2,1,3,1,0,6,-1,98,0,22,2,1,3,1,0,6,-1,98,0,22,2,1,3,1,0,6,-1,98,0,22,2,1,3,1,0,6,-1,98,0,22,2,1,3,1,0,6,-1,98,0,22,2,1,3,1,0,6,-1,98,0,22,2,1,3,1,0,6,-1,98,0,22,2,1,3,1,0,6,-1,98,0,22,2,1,3,1,0,6,-1,98,0,22,2,1,3,1,0,6,-1,98,0,22,2,1,3,1,0,6,-1,98,0,22,2,1,3,1,0,6,-1,98,0,22,2,1,3,1,0,6,-1,120,2,1,3,1,-1,126,2,1,3,1,-1,104,0,22,2,1,3,1,0,6,-1,98,0,22,2,1,3,1,0,6,-1,51,10,2,-1,45,0,22,2,1,3,1,0,6,-1,49,10,5,-1,44,0,4,-1,6,0,12,2,1,3,1,0,6,-1,47,10,9,-1,42,0,4,-1,6,0,12,2,1,3,1,0,6,-1,48,10,8,-1,42,0,4,-1,6,0,12,2,1,3,1,0,6,-1,46,10,7,11,1,12,1,13,2,14,1,-1,40,0,4,-1,6,0,12,2,1,3,1,0,16,-1,40,10,3,15,1,10,3,-1,41,0,4,-1,6,0,12,2,1,3,1,0,16,-1,42,10,1,15,1,10,3,-1,41,0,5,-1,4,0,13,2,1,3,1,0,16,-1,43,16,1,17,1,18,1,-1,42,0,22,2,1,3,1,0,16,-1,88,0,22,2,1,3,1,0,16,-1,88,0,22,2,1,3,1,0,16,-1,88,0,22,2,1,3,1,0,16,-1,88,0,22,2,1,3,1,0,16,-1,88,0,17,-1,119,2,1,3,1,-1,36,4,82,0,8,2,1,3,1,0,7,-1,111,0,8,2,1,3,1,0,7,-1,111],
      "cells": 2078
    },
    "interior1": {
      "encoding": "rle",
      "data": [-1,30,9,6,-1,122,9,6,-1,122,9,4,-1,124,9,4,-1,124,9,4,-1,124,9,4,-1,124,9,4,-1,108,139,1,-1,1,140,1,139,1,141,1,-1,11,9,4,-1,124,9,5,-1,107,142,1,141,1,143,1,140,1,-1,12,9,5,-1,123,9,3,-1,97,120,1,121,1,-1,5,120,1,121,1,-1,3,142,1,140,1,139,1,143,1,140,1,-1,11,9,3,-1,95,122,1,123,1,124,2,125,1,126,1,-1,1,122,1,123,1,124,2,125,1,126,1,-1,17,9,3,-1,95,127,1,128,1,129,1,130,1,131,1,132,1,-1,1,127,1,128,1,129,1,130,1,131,1,132,1,-1,1,143,1,139,1,-1,1,142,1,141,1,-1,11,9,5,-1,93,127,1,128,1,133,1,134,1,131,1,132,1,-1,1,127,1,128,1,133,1,134,1,131,1,132,1,-1,17,9,5,-1,93,135,1,-1,1,133,1,134,1,-1,1,136,1,-1,1,135,1,-1,1,133,1,134,1,-1,1,136,1,-1,17,9,5,-1,123,9,7,-1,121,9,6,-1,122,9,6,-1,122,9,6,-1,122,9,6,-1,96,171,1,172,4,173,1,-1,20,9,6,-1,96,174,1,-1,4,175,1,-1,20,9,6,-1,96,174,1,-1,4,175,1,-1,20,9,6,-1,96,174,1,-1,4,175,1,-1,20,9,6,-1,96,176,1,177,4,178,1,-1,20,9,6,-1,97,179,1,180,1,181,1,182,1,-1,21,9,6,-1,122,9,6,-1,96,120,1,121,1,-1,9,120,1,121,1,-1,13,9,6,-1,94,122,1,123,1,124,2,125,1,126,1,-1,5,122,1,123,1,124,2,125,1,126,1,-1,11,9,6,-1,94,127,1,128,1,129,1,130,1,131,1,132,1,-1,5,127,1,128,1,129,1,130,1,131,1,132,1,-1,11,9,6,-1,94,127,1,128,1,133,1,134,1,131,1,132,1,-1,5,127,1,128,1,133,1,134,1,131,1,132,1,-1,11,9,6,-1,94,135,1,-1,1,133,1,134,1,-1,1,136,1,-1,5,135,1,-1,1,133,1,134,1,-1,1,136,1,-1,11,9,6,-1,122,9,6,-1,122,9,6,-1,122,9,6,-1,122,9,6,-1,122,9,6,-1,122,9,4,-1,124,9,4,-1,124,9,4,-1,124,9,4,-1,124,9,4,-1,124,9,4,-1,124,9,5,-1,123,9,5,-1,123,9,3,-1,97,120,1,121,1,-1,5,120,1,121,1,-1,19,9,3,-1,95,122,1,123,1,124,2,125,1,126,1,-1,1,122,1,123,1,124,2,125,1,126,1,-1,17,9,3,-1,95,127,1,128,1,129,1,130,1,131,1,132,1,-1,1,127,1,128,1,129,1,130,1,131,1,132,1,-1,17,9,5,-1,93,127,1,128,1,133,1,134,1,131,1,132,1,-1,1,127,1,128,1,133,1,134,1,131,1,132,1,-1,17,9,5,-1,93,135,1,-1,1,133,1,134,1,-1,1,136,1,-1,1,135,1,-1,1,133,1,134,1,-1,1,136,1,-1,17,9,5,-1,123,9,7,-1,121,9,6,-1,122,9,6,-1,122,9,6,-1,43,104,1,105,1,-1,2,106,1,107,1,108,1,-1,72,9,12,-1,35,104,1,105,1,-1,5,109,1,106,1,107,1,108,1,-1,44,171,1,172,4,173,1,-1,20,9,12,-1,34,110,1,-1,4,111,2,-1,3,109,1,112,1,-1,44,174,1,-1,4,175,1,-1,20,9,12,-1,34,104,1,105,1,-1,2,111,1,-1,5,106,1,107,1,108,1,-1,43,174,1,-1,4,175,1,-1,20,9,12,-1,33,110,1,-1,12,112,1,-1,43,174,1,-1,4,175,1,-1,66,113,1,114,1,111,2,-1,7,115,1,-1,44,176,1,177,4,178,1,-1,68,113,1,114,1,111,2,-1,5,116,1,-1,45,179,1,180,1,181,1,182,1,-1,73,234,1,-1,3,116,1,-1,698,9,29,-1,37,235,1,-1,61,9,29,-1,99,9,111,-1,17,9,111],
      "cells": 856
    },
    "interior2": {
      "encoding": "rle",
      "data": [-1,7720,118,1,-1,127,118,1,-1,127,118,1,-1,127,118,1,-1,127,118,1,-1,127,118,1,-1,127,118,1,-1,127,118,1,-1,599],
      "cells": 8
    },
    "structure_front": {
      "encoding": "rle",
      "data": [-1,2067,0,3,-1,2,0,3,-1,120,0,3,-1,2,0,3,-1,2040,0,3,-1,2,0,3,-1,2424,0,3,-1,2,0,3,-1,120,0,3,-1,2,0,3,-1,2026,0,3,-1,2,0,3,-1,371],
      "cells": 36
    },
    "collision": {
      "encoding": "rle",
      "data": [-1,30,2,6,-1,122,2,6,-1,122,2,4,-1,124,2,4,-1,124,2,4,-1,124,2,4,-1,124,2,4,-1,124,2,4,-1,124,2,5,-1,123,2,5,-1,123,2,3,-1,125,2,3,-1,125,2,3,-1,125,2,5,-1,123,2,5,-1,123,2,5,-1,93,2,37,-1,91,2,36,-1,114,3,2,-1,6,2,6,-1,114,3,2,-1,6,2,6,-1,114,3,2,-1,6,2,6,-1,114,3,2,-1,6,2,6,-1,97,2,4,-1,13,3,2,-1,6,2,6,-1,97,2,4,-1,13,3,2,-1,6,2,6,-1,97,2,4,-1,13,3,2,-1,6,2,6,-1,114,3,2,-1,6,2,6,-1,114,3,2,-1,6,2,6,-1,114,3,2,-1,6,2,6,-1,114,3,2,-1,6,2,6,-1,114,3,2,-1,6,2,6,-1,114,3,2,-1,6,2,6,-1,114,3,2,-1,6,2,6,-1,114,3,2,-1,6,2,6,-1,92,2,36,-1,114,3,2,-1,6,2,6,-1,114,3,2,-1,6,2,6,-1,114,3,2,-1,6,2,6,-1,114,3,2,-1,6,2,6,-1,114,3,2,-1,6,2,4,-1,116,3,2,-1,6,2,4,-1,116,3,2,-1,6,2,4,-1,116,3,2,-1,6,2,4,-1,116,3,2,-1,6,2,4,-1,116,3,2,-1,6,2,4,-1,116,3,2,-1,6,2,5,-1,115,3,2,-1,6,2,5,-1,115,3,2,-1,6,2,3,-1,117,3,2,-1,6,2,3,-1,117,3,2,-1,6,2,3,-1,117,3,2,-1,6,2,5,-1,115,3,2,-1,6,2,5,-1,115,3,2,-1,6,2,5,-1,93,2,37,-1,91,2,36,-1,114,3,2,-1,6,2,6,-1,114,3,2,-1,6,2,6,-1,114,3,2,-1,6,2,12,-1,108,3,2,-1,6,2,12,-1,91,2,4,-1,13,3,2,-1,6,2,12,-1,91,2,4,-1,13,3,2,-1,6,2,12,-1,91,2,4,-1,13,3,2,-1,126,3,2,-1,126,3,2,-1,126,3,2,-1,126,3,2,-1,126,3,2,-1,126,3,2,-1,126,3,2,-1,121,2,29,-1,82,2,128,-1,8,3,2,-1,7,2,111,-1,8,3,2,-1,7,2,111],
      "cells": 985
    }
  },
  "entities": [
    {
      "type": "panther",
      "position": [50.75, 65.0],
      "params": {
        "patrol_distance": 120,
        "origin": "top_left",
        "size_px": [64, 32]
      },
      "id": "lawn_east"
    }
  ],
  "meta": {
    "source": "res://scenes/world/chunks/chunk_04_02.tscn"
  }
}
