{"schema_version":1,"chunk_id":"chunk_01_00","grid_size":[128,72],"cell_size":8,"empty_id":-1,"tile_id_map":"res://assets/tilesets/tile_id_map.json","layers":{"structure":{"encoding":"rle","data":[-1,6747,0,28,-1,2,0,6,-1,92,0,28,-1,2,0,6,-1,2039,0,10,-1,91,0,31,-1,97,0,31,-1,6],"cells":140},"wallpaper":{"encoding":"rle","data":[-1,4840,6,1,7,7,8,1,-1,119,9,1,-1,7,10,1,-1,119,9,1,-1,7,10,1,-1,119,9,1,-1,7,10,1,-1,119,9,1,-1,7,10,1,-1,119,11,1,12,8,-1,1650,6,1,7,7,8,1,-1,119,9,1,-1,7,10,1,-1,119,9,1,-1,7,10,1,-1,119,9,1,-1,7,10,1,-1,119,9,1,-1,7,10,1,-1,119,11,1,12,7,13,1,-1,1428],"cells":52},"mosaic":{"encoding":"rle","data":[-1,4699,0,28,2,1,3,1,0,6,-1,92,0,13,-1,9,0,6,2,1,3,1,0,6,-1,92,0,13,-1,9,0,6,2,1,3,1,0,6,-1,92,0,13,-1,9,0,6,2,1,3,1,0,6,-1,92,0,13,-1,9,0,6,2,1,3,1,0,6,-1,92,0,13,-1,9,0,6,2,1,3,1,0,6,-1,92,0,13,-1,9,0,6,2,1,3,1,0,6,-1,92,0,28,2,1,3,1,0,6,-1,92,0,7,-1,5,0,16,2,1,3,1,0,6,-1,92,0,7,-1,5,0,3,-1,3,0,10,2,1,3,1,0,6,-1,92,0,7,-1,5,0,3,-1,3,0,3,-1,4,0,3,2,1,3,1,0,6,-1,92,0,7,-1,5,0,3,-1,3,0,3,-1,4,0,3,2,1,3,1,0,6,-1,92,0,7,-1,5,0,3,-1,5,0,1,-1,4,0,3,2,1,3,1,0,6,-1,92,0,7,-1,5,0,3,-1,7,0,1,-1,3,0,2,2,1,3,1,0,6,-1,92,0,7,-1,5,0,3,-1,7,0,1,-1,3,0,2,2,1,3,1,0,6,-1,92,0,7,-1,5,0,3,-1,7,0,1,-1,3,0,2,2,1,3,1,0,6,-1,120,2,1,3,1,-1,126,2,1,3,1,-1,98,0,28,2,1,3,1,0,6,-1,92,0,8,-1,9,0,11,2,1,3,1,0,6,-1,92,0,8,-1,9,0,11,2,1,3,1,0,6,-1,92,0,8,-1,9,0,11,2,1,3,1,0,6,-1,92,0,8,-1,9,0,11,2,1,3,1,0,6,-1,92,0,8,-1,9,0,11,2,1,3,1,0,6,-1,92,0,8,-1,9,0,11,2,1,3,1,0,7,-1,91,0,28,2,1,3,1,0,7,-1,91,0,8,-1,5,0,6,-1,5,0,4,2,1,3,1,0,7,-1,91,0,8,-1,5,0,6,-1,5,0,4,2,1,3,1,0,7,-1,91,0,8,-1,5,0,6,-1,5,0,4,2,1,3,1,0,7,-1,91,0,8,-1,5,0,6,-1,5,0,4,2,1,3,1,0,7,-1,91,0,8,-1,5,0,6,-1,5,0,4,2,1,3,1,0,7,-1,91,0,8,-1,5,0,6,-1,5,0,4,2,1,3,1,0,7,-1,91,0,8,-1,5,0,6,-1,5,0,4,2,1,3,1,0,7,-1,91,0,8,-1,5,0,6,-1,5,0,3,-1,132,0,6,-1,122,0,6],"cells":884},"interior1":{"encoding":"rle","data":[-1,3950,0,1,1,1,-1,1,0,1,1,1,-1,123,3,1,4,1,-1,1,3,1,4,1,-1,123,6,1,7,1,-1,1,6,1,7,1,-1,1,9,3,52,1,53,1,9,3,-1,93,9,30,52,1,53,1,9,7,-1,89,9,30,52,1,53,1,9,7,-1,89,9,30,52,1,53,1,9,7,-1,89,9,2,-1,36,9,1,-1,89,9,2,-1,36,9,1,-1,89,9,2,-1,36,9,1,-1,89,9,2,-1,36,9,1,-1,89,9,2,-1,36,9,1,-1,89,9,2,-1,36,9,1,-1,89,9,2,-1,36,9,1,-1,89,9,2,-1,36,9,1,-1,89,9,2,-1,7,76,1,77,1,78,1,77,1,79,1,-1,24,9,1,-1,89,9,2,-1,7,80,1,81,1,82,1,81,1,83,1,-1,24,9,1,-1,89,9,2,-1,7,80,1,81,1,82,1,81,1,83,1,-1,24,9,1,-1,89,9,2,-1,7,80,1,84,1,85,1,86,1,83,1,-1,24,9,1,-1,89,9,2,-1,7,80,1,81,1,82,1,81,1,83,1,-1,24,9,1,-1,89,9,2,-1,7,80,1,81,1,82,1,81,1,83,1,-1,24,9,1,-1,89,9,2,-1,7,80,1,81,1,82,1,81,1,83,1,-1,24,9,1,-1,89,9,2,-1,7,87,1,88,3,89,1,-1,24,9,1,-1,89,9,2,-1,36,9,1,-1,89,9,2,-1,36,9,1,-1,89,9,2,-1,36,9,1,-1,89,9,2,-1,36,9,1,-1,89,9,2,-1,36,9,1,-1,89,9,2,-1,36,9,1,-1,89,9,2,-1,36,9,1,-1,89,9,2,-1,36,9,1,-1,89,9,2,-1,126,9,2,-1,126,9,2,-1,8,76,1,77,1,78,1,77,1,79,1,-1,6,76,1,77,1,78,1,77,1,79,1,-1,102,9,2,-1,8,80,1,81,1,82,1,81,1,83,1,-1,6,80,1,81,1,82,1,81,1,83,1,-1,102,9,2,-1,8,80,1,81,1,82,1,81,1,83,1,-1,6,80,1,81,1,82,1,81,1,83,1,-1,102,9,2,-1,8,80,1,84,1,85,1,86,1,83,1,-1,6,80,1,84,1,85,1,86,1,83,1,-1,102,9,2,-1,8,80,1,81,1,82,1,81,1,83,1,-1,6,80,1,81,1,82,1,81,1,83,1,-1,102,9,2,-1,8,80,1,81,1,82,1,81,1,83,1,-1,6,80,1,81,1,82,1,81,1,83,1,-1,102,9,2,-1,8,80,1,81,1,82,1,81,1,83,1,-1,6,80,1,81,1,82,1,81,1,83,1,-1,102,9,2,-1,8,87,1,88,3,89,1,-1,6,87,1,88,3,89,1,-1,102,9,2,-1,126,9,2,-1,37],"cells":353},"interior2":{"encoding":"rle","data":[-1,5866,15,1,16,1,17,1,-1,125,18,1,19,1,20,1,-1,3,15,1,16,2,17,1,-1,118,21,1,22,1,23,1,-1,3,18,1,19,2,20,1,-1,118,15,1,16,3,17,1,-1,1,21,1,22,2,23,1,-1,118,18,1,19,3,15,1,16,1,17,1,-1,1,15,1,16,1,17,1,-1,117,18,1,19,3,18,1,19,1,20,1,-1,1,18,1,19,1,20,1,-1,117,21,1,22,3,21,1,22,1,23,1,-1,1,21,1,22,1,23,1,-1,2571],"cells":56},"structure_front":{"encoding":"rle","data":[-1,6772,0,3,-1,2,0,3,-1,120,0,3,-1,2,0,3,-1,2308],"cells":12},"collision":{"encoding":"rle","data":[-1,3950,1,2,-1,1,1,2,-1,123,1,1,-1,2,1,1,-1,124,1,1,-1,2,1,1,-1,2,2,8,-1,93,2,39,-1,89,2,30,3,2,2,7,-1,89,2,30,3,2,2,7,-1,89,2,2,-1,28,3,2,-1,6,2,1,-1,89,2,2,-1,28,3,2,-1,6,2,1,-1,89,2,2,-1,28,3,2,-1,6,2,1,-1,89,2,2,-1,28,3,2,-1,6,2,1,-1,89,2,2,-1,28,3,2,-1,6,2,1,-1,89,2,2,-1,28,3,2,-1,6,2,1,-1,89,2,2,-1,28,3,2,-1,6,2,1,-1,89,2,2,-1,28,3,2,-1,6,2,1,-1,89,2,2,-1,28,3,2,-1,6,2,1,-1,89,2,2,-1,28,3,2,-1,6,2,1,-1,89,2,2,-1,28,3,2,-1,6,2,1,-1,89,2,2,-1,28,3,2,-1,6,2,1,-1,89,2,2,-1,28,3,2,-1,6,2,1,-1,89,2,2,-1,28,3,2,-1,6,2,1,-1,89,2,2,-1,28,3,2,-1,6,2,1,-1,89,2,2,-1,28,3,2,-1,6,2,1,-1,89,2,39,-1,89,2,39,-1,89,2,2,-1,28,3,2,-1,6,2,1,-1,89,2,2,-1,28,3,2,-1,6,2,1,-1,89,2,2,-1,28,3,2,-1,6,2,1,-1,89,2,2,-1,28,3,2,-1,6,2,1,-1,89,2,2,-1,28,3,2,-1,6,2,1,-1,89,2,2,-1,28,3,2,-1,6,2,1,-1,89,2,2,-1,28,3,2,-1,96,2,2,-1,28,3,2,-1,96,2,2,-1,28,3,2,-1,96,2,2,-1,28,3,2,-1,96,2,2,-1,28,3,2,-1,96,2,2,-1,28,3,2,-1,96,2,2,-1,28,3,2,-1,96,2,2,-1,28,3,2,-1,96,2,2,-1,28,3,2,-1,96,2,2,-1,27,2,10,-1,89,2,33,-1,95,2,33,-1,6],"cells":435}},"entities":[{"type":"document","position":[112.0,69.0],"params":{"required":"key"},"id":"document"},{"type":"guard","position":[95.0,63.0],"params":{"patrol":24},"id":"upper"}],"meta":{"source":"res://scenes/world/chunks/chunk_01_00.tscn"}}