{"schema_version":1,"chunk_id":"chunk_05_00","grid_size":[128,72],"cell_size":8,"empty_id":-1,"tile_id_map":"res://assets/tilesets/tile_id_map.json","layers":{"interior1":{"encoding":"rle","data":[-1,6645,236,1,-1,127,236,1,-1,127,236,1,-1,127,236,1,-1,127,236,1,-1,127,236,1,-1,127,236,1,-1,127,236,1,-1,127,236,1,-1,127,236,1,-1,127,236,1,-1,127,236,1,-1,127,236,1,-1,127,236,1,-1,127,236,1,-1,127,236,1,-1,127,236,1,-1,127,236,1,-1,127,236,1,-1,126,237,1,238,1,237,1,-1,125,239,1,-1,1,239,1,-1,9],"cells":24}},"entities":[],"meta":{"source":"res://scenes/world/chunks/chunk_05_00.tscn"}}